comment_order,comment_date,comment_text,comment_likes,cleaned_comment_text
1,2024-10-05 17:34:17,"
Welcome to r/Morocco! Please always make sure to take the time to [read the rules](https://www.reddit.com/r/morocco/wiki/rules) of this community, follow them and help us enforce them by reporting offenders. And remember that we have a zero tolerance policy for non-civil discourse and offenders risk being permanently banned.

[Don't forget to join the Discord server!](https://discord.gg/rmorocco)

**Important Notice:** Please note that the Discord channel's moderation team functions autonomously from the Reddit team. The Discord server does not extend our community guidelines and maintains a separate set of rules unrelated to those of Reddit.

Enjoy your time!


*I am a bot, and this action was performed automatically. Please [contact the moderators of this subreddit](/message/compose/?to=/r/Morocco) if you have any questions or concerns.*",1,"
Welcome to r/Morocco! Please always make sure to take the time to [read the rules]( of this community, follow them and help us enforce them by reporting offenders. And remember that we have a zero tolerance policy for non-civil discourse and offenders risk being permanently banned.

[Don't forget to join the Discord server!](

**Important Notice** Please note that the Discord channel's moderation team functions autonomously from the Reddit team. The Discord server does not extend our community guidelines and maintains a separate set of rules unrelated to those of Reddit.

Enjoy your time!


*I am a bot, and this action was performed automatically. Please [contact the moderators of this subreddit](/message/compose/?to=/r/Morocco) if you have any questions or concerns.*"
2,2024-10-05 18:00:18,IAM is best if you can,2,IAM is best if you can
3,2024-10-05 19:20:54,"20mbit is not fiber. Anyway, you go to the agency and explain in detail where you live and they will tell you if you can be serviced there. Rest is easy and quick.

There are three providers. they are not the same but similar in the way they are bad.

Maroc telecom seems to have the best coverage. But practically no service. 

Orange is less widely available but they at least have a ticketing system and accept support tickets in writing.

INWI is the underdog. I think they cut more corners but that might not be a bad thing. In our building complex orange and Maroc telecom came into the house underground and through the normal conduits. INWI just ran the fiber over the roof. 🤷",1,"20mbit is not fiber. Anyway, you go to the agency and explain in detail where you live and they will tell you if you can be serviced there. Rest is easy and quick.

There are three providers. they are not the same but similar in the way they are bad.

Maroc telecom seems to have the best coverage. But practically no service. 

Orange is less widely available but they at least have a ticketing system and accept support tickets in writing.

INWI is the underdog. I think they cut more corners but that might not be a bad thing. In our building complex orange and Maroc telecom came into the house underground and through the normal conduits. INWI just ran the fiber over the roof. 🤷"
4,2024-10-05 19:21:18,And I would avoid them at all costs. 😂,1,And I would avoid them at all costs. 
5,2024-10-06 01:51:49,"I recommend it too , we had for almost a year now with barely any problems.",1,"I recommend it too , we had for almost a year now with barely any problems."
6,2024-10-06 06:53:18,do you know how much a router gon cost? also inwi have a 20 mb offer for fiber,1,do you know how much a router gon cost? also inwi have a 20 mb offer for fiber
7,2024-10-05 19:24:13,[deleted],2,[deleted]
8,2024-10-06 08:24:51,Router is free,1,Router is free
9,2024-10-05 19:25:15,I hope the streak continues. 🤞,1,I hope the streak continues. 🤞
1,2024-09-17 04:43:29,"
Welcome to r/Morocco! Please always make sure to take the time to [read the rules](https://www.reddit.com/r/morocco/wiki/rules) of this community, follow them and help us enforce them by reporting offenders. And remember that we have a zero tolerance policy for non-civil discourse and offenders risk being permanently banned.

[Don't forget to join the Discord server!](https://discord.gg/rmorocco)

**Important Notice:** Please note that the Discord channel's moderation team functions autonomously from the Reddit team. The Discord server does not extend our community guidelines and maintains a separate set of rules unrelated to those of Reddit.

Enjoy your time!


*I am a bot, and this action was performed automatically. Please [contact the moderators of this subreddit](/message/compose/?to=/r/Morocco) if you have any questions or concerns.*",1,"
Welcome to r/Morocco! Please always make sure to take the time to [read the rules]( of this community, follow them and help us enforce them by reporting offenders. And remember that we have a zero tolerance policy for non-civil discourse and offenders risk being permanently banned.

[Don't forget to join the Discord server!](

**Important Notice** Please note that the Discord channel's moderation team functions autonomously from the Reddit team. The Discord server does not extend our community guidelines and maintains a separate set of rules unrelated to those of Reddit.

Enjoy your time!


*I am a bot, and this action was performed automatically. Please [contact the moderators of this subreddit](/message/compose/?to=/r/Morocco) if you have any questions or concerns.*"
2,2024-09-17 04:48:57,"la3eb league tanta, daro fik khir , tstahl a bro",9,"la3eb league tanta, daro fik khir , tstahl a bro"
3,2024-09-17 05:14:06,Inwi told you to go touch some grass,4,Inwi told you to go touch some grass
4,2024-09-17 05:53:15,"fach kano ybaniwni 14 knt kanfr7, kansmih conge hadak",3,"fach kano ybaniwni 14 knt kanfr7, kansmih conge hadak"
5,2024-09-17 05:15:16,Game d zab khasshom gha 3la ybaniw bnadem (I got perma banned f chi 4 accounts hhhhhhhhh),2,Game d zab khasshom gha 3la ybaniw bnadem (I got perma banned f chi 4 accounts hhhhhhhhh)
6,2024-09-17 06:32:07,"Get Orange, in one year I only had my wifi lose internet once for a few hours. That's a very good record.",1,"Get Orange, in one year I only had my wifi lose internet once for a few hours. That's a very good record."
1,2024-09-22 19:00:27,"Ah yes, Mikazuki’s force ghost coming to assist Akatsuki.",2,"Ah yes, Mikazuki’s force ghost coming to assist Akatsuki."
2,2024-09-22 22:41:45,"kinda funny how this ""clear"" version of the hg kit include the smoothbore gun, and the clear version of lupus include his 2 x 200mm Gun (2 x 20mm Machine Gun) but the basic hg kits for the both of these don't. and the 6th form clear kit doesn't include anything that's left out from the normal release like the Long Sword (upgraded with white hilt)",2,"kinda funny how this ""clear"" version of the hg kit include the smoothbore gun, and the clear version of lupus include his 2 x 200mm Gun (2 x 20mm Machine Gun) but the basic hg kits for the both of these don't. and the 6th form clear kit doesn't include anything that's left out from the normal release like the Long Sword (upgraded with white hilt)"
3,2024-09-22 19:02:02,"Bandai thinking of how to make that just another reskin of this clear color version: WRITE THAT DOWN, WRITE IT DOWN!!!",2,"Bandai thinking of how to make that just another reskin of this clear color version WRITE THAT DOWN, WRITE IT DOWN!!!"
4,2024-09-24 03:50:57,"If you read Seed Astray manga, that's what happens to Canard Pars in his journey to atone himself.

The ghost of Prayer Reverie literally guide him.",1,"If you read Seed Astray manga, that's what happens to Canard Pars in his journey to atone himself.

The ghost of Prayer Reverie literally guide him."
5,2024-09-22 22:43:50,forgot to mention but clear HG lupus also have those twin small maces too,2,forgot to mention but clear HG lupus also have those twin small maces too
6,2024-09-22 23:34:36,"Yeah, the original HG were produced before the expansion sets with the added rifles and cannons, since these were releases with similar thing as the oeiginal release, they added this to sell it as something people might want more.

Plus these are non P Bandai, once we got the Rex, that became part of that line up.",1,"Yeah, the original HG were produced before the expansion sets with the added rifles and cannons, since these were releases with similar thing as the oeiginal release, they added this to sell it as something people might want more.

Plus these are non P Bandai, once we got the Rex, that became part of that line up."
7,2024-09-22 19:03:31,"That’s literally me on how i design suits for Demon Incarnate.

""Oh, you want Damon and Miru’s custom Aiolos?""

*slaps P-Bandai*

""That’ll be 130 dollars.""",2,"That’s literally me on how i design suits for Demon Incarnate.

""Oh, you want Damon and Miru’s custom Aiolos?""

*slaps P-Bandai*

""That’ll be 130 dollars."""
8,2024-09-28 18:37:57,I mean the Tamashii side branch of Bandai did that with SDCC Sh Figuarts SS1 Gohan and SS1 Full power Goku earlier this year.,2,I mean the Tamashii side branch of Bandai did that with SDCC Sh Figuarts SS1 Gohan and SS1 Full power Goku earlier this year.
1,2024-09-11 23:04:24,"
Welcome to r/Morocco! Please always make sure to take the time to [read the rules](https://www.reddit.com/r/morocco/wiki/rules) of this community, follow them and help us enforce them by reporting offenders. And remember that we have a zero tolerance policy for non-civil discourse and offenders risk being permanently banned.

[Don't forget to join the Discord server!](https://discord.gg/rmorocco)

**Important Notice:** Please note that the Discord channel's moderation team functions autonomously from the Reddit team. The Discord server does not extend our community guidelines and maintains a separate set of rules unrelated to those of Reddit.

Enjoy your time!


*I am a bot, and this action was performed automatically. Please [contact the moderators of this subreddit](/message/compose/?to=/r/Morocco) if you have any questions or concerns.*",1,"
Welcome to r/Morocco! Please always make sure to take the time to [read the rules]( of this community, follow them and help us enforce them by reporting offenders. And remember that we have a zero tolerance policy for non-civil discourse and offenders risk being permanently banned.

[Don't forget to join the Discord server!](

**Important Notice** Please note that the Discord channel's moderation team functions autonomously from the Reddit team. The Discord server does not extend our community guidelines and maintains a separate set of rules unrelated to those of Reddit.

Enjoy your time!


*I am a bot, and this action was performed automatically. Please [contact the moderators of this subreddit](/message/compose/?to=/r/Morocco) if you have any questions or concerns.*"
2,2024-09-12 01:10:41,what,1,what
3,2024-09-12 12:08:53,"I got one too , I think it's only working inside the university so u can connect to their wifi",1,"I got one too , I think it's only working inside the university so u can connect to their wifi"
4,2024-09-12 05:30:39,"They are giving out free sim cards when you enroll in a university so you can ""stay connected"" all the time",1,"They are giving out free sim cards when you enroll in a university so you can ""stay connected"" all the time"
5,2024-09-17 01:36:07,"They looked me in the eye and lied to me,free internet they said,unlimited they said,everywhere you go they said. Time to do what my dad once did time to burn that shi",1,"They looked me in the eye and lied to me,free internet they said,unlimited they said,everywhere you go they said. Time to do what my dad once did time to burn that shi"
6,2024-09-19 13:28:21,So .I just learned it's practically as useful as sndala mwdra liha frda.,1,So .I just learned it's practically as useful as sndala mwdra liha frda.
7,2024-09-19 16:43:52,Yh it only gives u  access without internet to the website of the uni,1,Yh it only gives u  access without internet to the website of the uni
1,2024-09-19 02:11:14,"
Welcome to r/Morocco! Please always make sure to take the time to [read the rules](https://www.reddit.com/r/morocco/wiki/rules) of this community, follow them and help us enforce them by reporting offenders. And remember that we have a zero tolerance policy for non-civil discourse and offenders risk being permanently banned.

[Don't forget to join the Discord server!](https://discord.gg/rmorocco)

**Important Notice:** Please note that the Discord channel's moderation team functions autonomously from the Reddit team. The Discord server does not extend our community guidelines and maintains a separate set of rules unrelated to those of Reddit.

Enjoy your time!


*I am a bot, and this action was performed automatically. Please [contact the moderators of this subreddit](/message/compose/?to=/r/Morocco) if you have any questions or concerns.*",1,"
Welcome to r/Morocco! Please always make sure to take the time to [read the rules]( of this community, follow them and help us enforce them by reporting offenders. And remember that we have a zero tolerance policy for non-civil discourse and offenders risk being permanently banned.

[Don't forget to join the Discord server!](

**Important Notice** Please note that the Discord channel's moderation team functions autonomously from the Reddit team. The Discord server does not extend our community guidelines and maintains a separate set of rules unrelated to those of Reddit.

Enjoy your time!


*I am a bot, and this action was performed automatically. Please [contact the moderators of this subreddit](/message/compose/?to=/r/Morocco) if you have any questions or concerns.*"
2,2024-09-19 16:56:13,"Orange can do it quite easy. It costs 20dh for the SIM. But you have to do it in branch, you can't just do it online.",1,"Orange can do it quite easy. It costs 20dh for the SIM. But you have to do it in branch, you can't just do it online."
3,2024-09-19 21:37:48,"They charge money for a virtual sim, that enables them to charge you more money?",1,"They charge money for a virtual sim, that enables them to charge you more money?"
4,2024-09-19 21:56:36,That's not the most absurd way telcos try to make you pay for stuff,1,That's not the most absurd way telcos try to make you pay for stuff
1,2024-09-15 05:45:11,56.yıl özel olanlarda böyleydi gerçi hala böyle bi kaç tanesine bakıyordum 2000den satıyordu elinde patlayınca 650tl ye düşürdü fiyati,4,56.yıl özel olanlarda böyleydi gerçi hala böyle bi kaç tanesine bakıyordum 2000den satıyordu elinde patlayınca 650tl ye düşürdü fiyati
2,2024-09-14 18:09:57,Ben bundan her yerde görüyorum görürsem eğer isteyene kargo parası karşılığı alıp yollarım.,6,Ben bundan her yerde görüyorum görürsem eğer isteyene kargo parası karşılığı alıp yollarım.
3,2024-09-14 17:51:11,"Serbest piyasa, almassan aldırmazsan düşer. Ama bu œvlatları inadına düşürmüyor.",5,"Serbest piyasa, almassan aldırmazsan düşer. Ama bu œvlatları inadına düşürmüyor."
4,2024-09-15 10:07:23,Üstüne 200 lira daha koyar sth supra alırım mk,2,Üstüne 200 lira daha koyar sth supra alırım mk
5,2024-09-14 18:44:56,Hocam öyle değil işte anlamıyosun. Bak 1 tane aracın var tamammı internete bakıyorsun herkez o araçı 1400 TL ye girmiş sonra diyosunki herkez 1400 e girmiş ben altına girersem zarar ederim. O yüzdende 1400 TL ye satıyosun anladın mı ? hiç bir şekilde düşmüyor bizim apartmanda da 9 yaşında bi velet var geçen 1400 tlye boş bi regular almış bari sth alsaydın aq.,6,Hocam öyle değil işte anlamıyosun. Bak 1 tane aracın var tamammı internete bakıyorsun herkez o araçı 1400 TL ye girmiş sonra diyosunki herkez 1400 e girmiş ben altına girersem zarar ederim. O yüzdende 1400 TL ye satıyosun anladın mı ? hiç bir şekilde düşmüyor bizim apartmanda da 9 yaşında bi velet var geçen 1400 tlye boş bi regular almış bari sth alsaydın aq.
6,2024-09-14 20:32:09,S3brys piyasa kanzmi,2,S3brys piyasa kanzmi
7,2024-09-15 11:25:54,Knk hepsiburada da 400 liraya satılıyo bu,2,Knk hepsiburada da 400 liraya satılıyo bu
8,2024-09-15 16:37:06,bende :D,1,bende D
9,2024-09-14 18:45:43,Herkez bu oevlatlarını görüp o fiyata giriyo ilan öyle öyle zincirleme işte,1,Herkez bu oevlatlarını görüp o fiyata giriyo ilan öyle öyle zincirleme işte
1,2024-09-10 18:35:45,The quality of the upcoming 6 vols is not consistent but is gets much better after ot11,11,The quality of the upcoming 6 vols is not consistent but is gets much better after ot11
2,2024-09-10 18:36:05,"Oh they will, however be advised that OT7 to OT11 it might seem to be hitting a bit of a slow period but its all a set up for later volumes where things get pretty crazy",3,"Oh they will, however be advised that OT7 to OT11 it might seem to be hitting a bit of a slow period but its all a set up for later volumes where things get pretty crazy"
3,2024-09-10 19:24:49,OT5 is really good yeah. next great volume is OT8 though imo,4,OT5 is really good yeah. next great volume is OT8 though imo
4,2024-09-11 06:05:25,What app is this?,1,What app is this?
5,2024-09-11 12:13:01,how do you get these data?,1,how do you get these data?
6,2024-09-11 07:09:02,Moonreader pro,1,Moonreader pro
7,2024-09-11 12:26:38,Moonreader pro app,1,Moonreader pro app
1,2024-09-08 22:30:21,"Its just how bakatsuki set up the reading+illustrations, its not really overlapping the text over its just got pushed to the side, the lines you can read on the left of the illustration are what you are suppose to read",2,"Its just how bakatsuki set up the reading+illustrations, its not really overlapping the text over its just got pushed to the side, the lines you can read on the left of the illustration are what you are suppose to read"
2,2024-09-08 22:31:29,"But on Kindle its normal, only in moonreader",2,"But on Kindle its normal, only in moonreader"
3,2024-09-08 22:36:28,"Then idk, it may be how the format adjusts it",1,"Then idk, it may be how the format adjusts it"
1,2024-08-31 10:09:42,"So we have spent around £11 million more than we have brought in, and that in a nutshell is the biggest problem we have. We are making next to zero money in player sales, and the quality of players we are looking to bring in are not readily available for cheap.
 
I think the way forward is really simple - nobody is allowed to survive the summer transfer window with less than a year left on their contract. If they refuse to sign they should be sold on to the highest bidder, and replaced.

 None of our players since the 90s / possibly early 00s have been irreplaceable for a similar price to what we should be recieving for them, so it's time to stop pretending they are and pandering to their every wish only for them to leave for free and forget all about us anyway.",14,"So we have spent around £11 million more than we have brought in, and that in a nutshell is the biggest problem we have. We are making next to zero money in player sales, and the quality of players we are looking to bring in are not readily available for cheap.
 
I think the way forward is really simple - nobody is allowed to survive the summer transfer window with less than a year left on their contract. If they refuse to sign they should be sold on to the highest bidder, and replaced.

 None of our players since the 90s / possibly early 00s have been irreplaceable for a similar price to what we should be recieving for them, so it's time to stop pretending they are and pandering to their every wish only for them to leave for free and forget all about us anyway."
2,2024-08-31 09:44:15,Connor barrons best bit of business. Future captain.,12,Connor barrons best bit of business. Future captain.
3,2024-08-31 09:51:53,"New rule please Rangers; nobody gets to be at the club with a year left on a contract, resign or sell them",11,"New rule please Rangers; nobody gets to be at the club with a year left on a contract, resign or sell them"
4,2024-08-31 18:14:00,Best part of 16m quid spent and rangers fans are saying we didn't spend enough. ,5,Best part of 16m quid spent and rangers fans are saying we didn't spend enough. 
5,2024-08-31 09:39:14,"No picture for Igamane is very fitting.

I wonder if he'll be named in any match day squad this season",3,"No picture for Igamane is very fitting.

I wonder if he'll be named in any match day squad this season"
6,2024-08-31 14:03:04,I want to hear the silence tomorrow,5,I want to hear the silence tomorrow
7,2024-08-31 12:49:57,That relief you feel when the transfer window closes and Lawrence Shankland isnae employed as a bench warner for rangers.,7,That relief you feel when the transfer window closes and Lawrence Shankland isnae employed as a bench warner for rangers.
8,2024-08-31 20:39:31,2.3 million on a striker that won’t get near the team 😩,4,2.3 million on a striker that won’t get near the team 
9,2024-08-31 10:31:30,Did we really spend that much igamane for him to not play? I’ve heard a lot how he won’t be ready this season. Seems like a huge outlay for someone who won’t benefit us this year.,5,Did we really spend that much igamane for him to not play? I’ve heard a lot how he won’t be ready this season. Seems like a huge outlay for someone who won’t benefit us this year.
10,2024-08-31 10:10:56,[removed],1,[removed]
11,2024-09-01 19:21:39,[removed],1,[removed]
12,2024-08-31 09:43:36,"I know people are excited about new players but to me, it doesn't really look like we fully fixed any problems in the squad. Not convinced that we're meaningfully better overall. 

However, the squad is much younger and cheaper now. Plus we moved on lots of players who were clearly not good enough. So in that respect it was a success. It's a shame the bid for Tavernier wasn't enough. 

This entire window was basically Part 1 of the rebuild. The quality just isn't there for a proper title challenge yet. There's still a core of players who aren't good enough or too injury prone - Matondo, Dowell, Hagi, Tavernier, Yilmaz, at least.",1,"I know people are excited about new players but to me, it doesn't really look like we fully fixed any problems in the squad. Not convinced that we're meaningfully better overall. 

However, the squad is much younger and cheaper now. Plus we moved on lots of players who were clearly not good enough. So in that respect it was a success. It's a shame the bid for Tavernier wasn't enough. 

This entire window was basically Part 1 of the rebuild. The quality just isn't there for a proper title challenge yet. There's still a core of players who aren't good enough or too injury prone - Matondo, Dowell, Hagi, Tavernier, Yilmaz, at least."
13,2024-08-31 11:53:49,Shocking we sell cantwell for 500k that's a fucking mistake . Wright for 300k . What's happening at rangers . Still no shankland I'm done with clement and the board . Get Dave King back in asap .,-26,Shocking we sell cantwell for 500k that's a fucking mistake . Wright for 300k . What's happening at rangers . Still no shankland I'm done with clement and the board . Get Dave King back in asap .
14,2024-08-31 18:23:02,"That's not true at all. People bang on about not selling morelos early enough, then forget hes made us more in European money than he ever had a bid for. At one point the third top goalscorer of all time in the europa league, bullying defenders like pepe and hummels. Wouldn't have made it past Dortmund to get tk the final and but for his only ever serious injury, we'd have a Europa trophy right now.


Same with Kent, for all his flaws, was vital in Europe for our counter attacking style and as the ball carrier step before the final decisive ball. 


Rangers cannot win. Some fans say ""we've not backed the manager"" while you're saying ""we've spent too much"". You've ignored the money off the wage bill, that translates to higher fees and lower wages, seeing as the old regime was ""low fees paid, higher wages"" and everyone agreed that was a disaster. ",5,"That's not true at all. People bang on about not selling morelos early enough, then forget hes made us more in European money than he ever had a bid for. At one point the third top goalscorer of all time in the europa league, bullying defenders like pepe and hummels. Wouldn't have made it past Dortmund to get tk the final and but for his only ever serious injury, we'd have a Europa trophy right now.


Same with Kent, for all his flaws, was vital in Europe for our counter attacking style and as the ball carrier step before the final decisive ball. 


Rangers cannot win. Some fans say ""we've not backed the manager"" while you're saying ""we've spent too much"". You've ignored the money off the wage bill, that translates to higher fees and lower wages, seeing as the old regime was ""low fees paid, higher wages"" and everyone agreed that was a disaster. "
