comment_order,comment_date,comment_text,comment_likes,cleaned_comment_text
36,2024-08-19 14:38:55,"LOL should have known that another ”DefendingAIArt” patriot hurt their feelings. 😂

This sub is beyound ironic and moronic.",-1,"LOL should have known that another ”DefendingAIArt” patriot hurt their feelings. 

This sub is beyound ironic and moronic."
1,2024-08-08 19:53:56,"For sale today is a very rare OEM SARB059 Alpinist Bezel. This bezel will fit any OEM or Aftermarket SKX007 case. It is in brand new condition and still sealed. 

This bezel features compass markings and dive timer markings so it is very useful for an adventure style watch and very versatile being that it will fit any SKX case.  

Price: $85 shipped to CONUS",1,"For sale today is a very rare OEM SARB059 Alpinist Bezel. This bezel will fit any OEM or Aftermarket SKX007 case. It is in brand new condition and still sealed. 

This bezel features compass markings and dive timer markings so it is very useful for an adventure style watch and very versatile being that it will fit any SKX case.  

Price $85 shipped to CONUS"
2,2024-08-26 00:21:10,"Missed out, been looking for one for a while. Nice find!",1,"Missed out, been looking for one for a while. Nice find!"
1,2024-08-07 01:57:34,"
Problem? Cross-post to [our new forum](https://forum.kustom.rocks/c/issues/5). Include make & model of phone, OS version, app version.

*I am a bot, and this action was performed automatically. Please [contact the moderators of this subreddit](/message/compose/?to=/r/kustom) if you have any questions or concerns.*",1,"
Problem? Cross-post to [our new forum]( Include make & model of phone, OS version, app version.

*I am a bot, and this action was performed automatically. Please [contact the moderators of this subreddit](/message/compose/?to=/r/kustom) if you have any questions or concerns.*"
2,2024-08-07 07:42:42,Disable parallel rendering in klwp,2,Disable parallel rendering in klwp
3,2024-08-10 20:53:32,"Looks really great, how can i do it in my Galaxy? I really want to see the album cover whenever I turn up my phone",2,"Looks really great, how can i do it in my Galaxy? I really want to see the album cover whenever I turn up my phone"
4,2024-08-07 10:43:17,To fix touch?,1,To fix touch?
5,2024-08-10 21:53:30,"Um you can get kwlp and experiment with it, once you get the hang of it it's pretty easy
Just install kwlp, install Goodluck and also lockstar. 
1.once kwlp is installed, create a new project and set it as your wallpaper.
2. Create a square and make it show the album cover
3. In the background Create a rectangle and make it fit your screen, also make it show you cover art, and make sure to blur it to about 85%
4.th you can make your own clock and date to fit the color scheme of the album art (if so make a clock and date and set the filter to overlay so it makes a cool filter to fit most cover arts)
4.2- if you don't want the hassle of making a clock you could always use the samsung one, just go to lockstar make the clock and music layer fit with the lockscreen and you're good to go

I know I haven't gotten much in depth on the kwlp aspect since it's VERY hard to explain the whole process in text form and my internet is very vary bad to upload a video you can just Google ""how to set cover art image  to square  in kwlp""and it'll give you everything you need to get started
PS: Kwlp may or may not drain your battery a tad bit faster since it's live wallpaper but it all depends on your phone. Also if you opt to choose the built in samsung clock you won't get the adaptive clock color since samsung for some reason does not allow auto coloring for livewallpaper (classic samsung) so will have a more functional clock( you can press on it to get the info and all) or you can get a aesthetic clock. The choice is always yours!

Happy customization!",1,"Um you can get kwlp and experiment with it, once you get the hang of it it's pretty easy
Just install kwlp, install Goodluck and also lockstar. 
1.once kwlp is installed, create a new project and set it as your wallpaper.
2. Create a square and make it show the album cover
3. In the background Create a rectangle and make it fit your screen, also make it show you cover art, and make sure to blur it to about 85%
4.th you can make your own clock and date to fit the color scheme of the album art (if so make a clock and date and set the filter to overlay so it makes a cool filter to fit most cover arts)
4.2- if you don't want the hassle of making a clock you could always use the samsung one, just go to lockstar make the clock and music layer fit with the lockscreen and you're good to go

I know I haven't gotten much in depth on the kwlp aspect since it's VERY hard to explain the whole process in text form and my internet is very vary bad to upload a video you can just Google ""how to set cover art image  to square  in kwlp""and it'll give you everything you need to get started
PS Kwlp may or may not drain your battery a tad bit faster since it's live wallpaper but it all depends on your phone. Also if you opt to choose the built in samsung clock you won't get the adaptive clock color since samsung for some reason does not allow auto coloring for livewallpaper (classic samsung) so will have a more functional clock( you can press on it to get the info and all) or you can get a aesthetic clock. The choice is always yours!

Happy customization!"
1,2024-07-25 13:24:31,"
Welcome to r/Morocco! Please always make sure to take the time to [read the rules](https://www.reddit.com/r/morocco/wiki/rules) of this community, follow them and help us enforce them by reporting offenders. And remember that we have a zero tolerance policy for non-civil discourse and offenders risk being permanently banned.

[Don't forget to join the Discord server!](https://discord.gg/rmorocco)

**Important Notice:** Please note that the Discord channel's moderation team functions autonomously from the Reddit team. The Discord server does not extend our community guidelines and maintains a separate set of rules unrelated to those of Reddit.

Enjoy your time!


*I am a bot, and this action was performed automatically. Please [contact the moderators of this subreddit](/message/compose/?to=/r/Morocco) if you have any questions or concerns.*",1,"
Welcome to r/Morocco! Please always make sure to take the time to [read the rules]( of this community, follow them and help us enforce them by reporting offenders. And remember that we have a zero tolerance policy for non-civil discourse and offenders risk being permanently banned.

[Don't forget to join the Discord server!](

**Important Notice** Please note that the Discord channel's moderation team functions autonomously from the Reddit team. The Discord server does not extend our community guidelines and maintains a separate set of rules unrelated to those of Reddit.

Enjoy your time!


*I am a bot, and this action was performed automatically. Please [contact the moderators of this subreddit](/message/compose/?to=/r/Morocco) if you have any questions or concerns.*"
2,2024-07-25 13:40:46,"fiber gives reliable internet even at peak hours. If you have shitty internet at 6/7pm, yes take fiber.",3,"fiber gives reliable internet even at peak hours. If you have shitty internet at 6/7pm, yes take fiber."
3,2024-07-25 13:42:20,ما بيهاش، الثمن مزيان، المهم أحسن بزاف من اللي عندك,2,ما بيهاش، الثمن مزيان، المهم أحسن بزاف من اللي عندك
4,2024-07-25 14:04:41,I’m using 20mb adsl extra from inwi and it’s good so far with some minor bugs from time to time but it costs only 149 for the first year not like paying 249dh and still have suck interest,2,I’m using 20mb adsl extra from inwi and it’s good so far with some minor bugs from time to time but it costs only 149 for the first year not like paying 249dh and still have suck interest
5,2024-07-25 14:29:25,Cracking deal!,2,Cracking deal!
6,2024-07-25 17:38:39,Im using 100mbps maroc telecom ou Im suffering I can't even watch  full hd videos,2,Im using 100mbps maroc telecom ou Im suffering I can't even watch  full hd videos
7,2024-07-25 14:20:37,"Check Orange 50mb, way better for the same price",1,"Check Orange 50mb, way better for the same price"
8,2024-07-25 14:08:18,I have a shitty internet all the day hhhhhhh,2,I have a shitty internet all the day hhhhhhh
9,2024-07-25 14:13:05,Lmhm hwa ykon lfer9 f lkhedma hit had adsl makaywslk.ta nes dyl dakchi li katkhles ☹️,1,Lmhm hwa ykon lfer9 f lkhedma hit had adsl makaywslk.ta nes dyl dakchi li katkhles 
10,2024-07-25 14:10:59,Yeap that's the problem high price bad service maroc telecom,2,Yeap that's the problem high price bad service maroc telecom
11,2024-07-25 18:38:35,I hate this operator 😤 no quality neither good prices,1,I hate this operator  no quality neither good prices
12,2024-07-25 14:28:51,are you sure?,1,are you sure?
13,2024-07-25 14:29:35,"you'll get 20mbit/s download, 10mbit/s upload, very low ping, 249dhs a month, I think the router and installation is free. some users reported unstable connection, it could be true, or maybe they're just using wifi. what you have now is unstable 12mbit/s download, 1mbit/s upload. ping is 60 ms higher than fiber.",2,"you'll get 20mbit/s download, 10mbit/s upload, very low ping, 249dhs a month, I think the router and installation is free. some users reported unstable connection, it could be true, or maybe they're just using wifi. what you have now is unstable 12mbit/s download, 1mbit/s upload. ping is 60 ms higher than fiber."
14,2024-07-25 15:06:25,Orange madayzax lina fl 7oma hiya knt baghi ndir wlln 50mega dayra 350dh,1,Orange madayzax lina fl 7oma hiya knt baghi ndir wlln 50mega dayra 350dh
15,2024-07-25 14:51:11,They said i will pay 150dh for the router 🤷🏽‍♂️,2,They said i will pay 150dh for the router 🤷
16,2024-07-25 14:53:15,good,2,good
1,2024-08-01 03:46:37,">Over the past 3 weeks have been doing things that I have never done before. I am allowing myself to learn healthy coping mechanisms. I feel myself frankly making decisions truly in my best interest and that has brought me more fulfillment than I've even felt in my entire life. Oh and I also sought out a therapist as soon as humanely possible. 

Would you be open to expanding on this?  Maybe explaining what has been helpful and why?",1,">Over the past 3 weeks have been doing things that I have never done before. I am allowing myself to learn healthy coping mechanisms. I feel myself frankly making decisions truly in my best interest and that has brought me more fulfillment than I've even felt in my entire life. Oh and I also sought out a therapist as soon as humanely possible. 

Would you be open to expanding on this?  Maybe explaining what has been helpful and why?"
2,2024-08-01 05:04:07,"Finally putting my thoughts and feelings into words was a huge first step.  This helped me actually understand where my fear and anxiety was coming from. I still feel a little uncomfortable in my own skin but I finally understand why now.  Once I figured this out it felt like my brain did a massive declutter. 

It is difficult to articulate what has been helpful as there is no road map for this sort of recovery. The only thing that makes sense to me at the moment is making healthier decisions (ex: better sleep hygiene,  exercise, being kinder to my inner self). I would like to emphasize the exercise portion. Not only has it been phenomenal for my mental health, it has also put me in touch with nature a little bit more as corny as that sounds",2,"Finally putting my thoughts and feelings into words was a huge first step.  This helped me actually understand where my fear and anxiety was coming from. I still feel a little uncomfortable in my own skin but I finally understand why now.  Once I figured this out it felt like my brain did a massive declutter. 

It is difficult to articulate what has been helpful as there is no road map for this sort of recovery. The only thing that makes sense to me at the moment is making healthier decisions (ex better sleep hygiene,  exercise, being kinder to my inner self). I would like to emphasize the exercise portion. Not only has it been phenomenal for my mental health, it has also put me in touch with nature a little bit more as corny as that sounds"
3,2024-08-01 16:03:08,">Once I figured this out it felt like my brain did a massive declutter.

The first steps of recovering from abuse are (1) validating that - yes - this is abuse, and then (2) re-contextualizing all your memories where the abuser gaslit you into believing their false reality.  Victims have to re-establish reality, it's so important, so your brain doing a 'massive declutter' makes sense.",2,">Once I figured this out it felt like my brain did a massive declutter.

The first steps of recovering from abuse are (1) validating that - yes - this is abuse, and then (2) re-contextualizing all your memories where the abuser gaslit you into believing their false reality.  Victims have to re-establish reality, it's so important, so your brain doing a 'massive declutter' makes sense."
1,2024-07-11 15:15:02,"
Welcome to r/Morocco! Please always make sure to take the time to [read the rules](https://www.reddit.com/r/morocco/wiki/rules) of this community, follow them and help us enforce them by reporting offenders. And remember that we have a zero tolerance policy for non-civil discourse and offenders risk being permanently banned.

[Don't forget to join the Discord server!](https://discord.gg/rmorocco)

**Important Notice:** Please note that the Discord channel's moderation team functions autonomously from the Reddit team. The Discord server does not extend our community guidelines and maintains a separate set of rules unrelated to those of Reddit.

Enjoy your time!


*I am a bot, and this action was performed automatically. Please [contact the moderators of this subreddit](/message/compose/?to=/r/Morocco) if you have any questions or concerns.*",1,"
Welcome to r/Morocco! Please always make sure to take the time to [read the rules]( of this community, follow them and help us enforce them by reporting offenders. And remember that we have a zero tolerance policy for non-civil discourse and offenders risk being permanently banned.

[Don't forget to join the Discord server!](

**Important Notice** Please note that the Discord channel's moderation team functions autonomously from the Reddit team. The Discord server does not extend our community guidelines and maintains a separate set of rules unrelated to those of Reddit.

Enjoy your time!


*I am a bot, and this action was performed automatically. Please [contact the moderators of this subreddit](/message/compose/?to=/r/Morocco) if you have any questions or concerns.*"
2,2024-07-11 16:04:23,"Anyone wondering why internet is expensive in Morocco:  this is your answer!!

One company had the monopoly of everything in the telecom industry and refused To share the infrastructures (that the government built) and blocked any kind of fair competition.",27,"Anyone wondering why internet is expensive in Morocco  this is your answer!!

One company had the monopoly of everything in the telecom industry and refused To share the infrastructures (that the government built) and blocked any kind of fair competition."
3,2024-07-11 15:35:34,Thats nice maroc telecome has been fucking up the other companies for a long time,11,Thats nice maroc telecome has been fucking up the other companies for a long time
4,2024-07-11 15:59:59,How convenient for the Moroccan royal family,7,How convenient for the Moroccan royal family
5,2024-07-11 15:49:26,">Maroc Telecom, which is listed on Casablanca stock exchange and on Euronext Paris, is 53% controlled by the UAE's Etisalat while the Moroccan state holds a 22% stake.

With a bit of searching, turns out UAE's Etisalat has been controlling those 53% shares of Maroc Telecom since 2014, after purchasing them from Vivendi, a French company.

Maroc my A\*\*. 🙂",6,">Maroc Telecom, which is listed on Casablanca stock exchange and on Euronext Paris, is 53% controlled by the UAE's Etisalat while the Moroccan state holds a 22% stake.

With a bit of searching, turns out UAE's Etisalat has been controlling those 53% shares of Maroc Telecom since 2014, after purchasing them from Vivendi, a French company.

Maroc my A\*\*. "
6,2024-07-11 17:56:25,UAE must leave IAM asap,3,UAE must leave IAM asap
7,2024-07-11 16:32:41,Probably a slap in the wrist for them,2,Probably a slap in the wrist for them
8,2024-07-11 23:49:15,Guess whose pocket this money is going.,1,Guess whose pocket this money is going.
9,2024-07-11 16:38:58,">Anyone wondering why internet is expensive in Morocco: this is your answer!!

i have a data plan in a french phone number, that allows me to use data in every single country in the world except morocco. Just UAE shareholders acting like scums.",10,">Anyone wondering why internet is expensive in Morocco this is your answer!!

i have a data plan in a french phone number, that allows me to use data in every single country in the world except morocco. Just UAE shareholders acting like scums."
10,2024-07-11 19:24:02,Infrastructure built by Moroccan people* likaydiro les lotissements not the government by itself,1,Infrastructure built by Moroccan people* likaydiro les lotissements not the government by itself
11,2024-07-12 11:56:45,samething will happen to water soon,1,samething will happen to water soon
12,2024-07-12 00:49:46,[deleted],1,[deleted]
13,2024-07-11 16:54:58,Many such convenient things happened in the past for the companies owned by the royal family. Strange.,2,Many such convenient things happened in the past for the companies owned by the royal family. Strange.
14,2024-07-11 16:15:32,Like blocking your competitors from having access to infrastructures that the government built not even the investors is FAIR.,1,Like blocking your competitors from having access to infrastructures that the government built not even the investors is FAIR.
15,2024-07-11 16:40:45,and inwi is 100% private and partially owned by the king.,4,and inwi is 100% private and partially owned by the king.
16,2024-07-11 16:13:07,Grow up dude and educate yourself a little bit about company's laws. Maroc telecom was a goverment entity until it was privatized. The name maroc telecom doesn't tish !!! The investors chose not to change it's name that's their right.,-1,Grow up dude and educate yourself a little bit about company's laws. Maroc telecom was a goverment entity until it was privatized. The name maroc telecom doesn't tish !!! The investors chose not to change it's name that's their right.
17,2024-07-11 18:02:41,The article says that the fine exceeds their 2023 revenue.,4,The article says that the fine exceeds their 2023 revenue.
18,2024-07-12 01:08:54,The king obv and not the UAE,1,The king obv and not the UAE
19,2024-07-11 16:52:46,Which network/data plan is this btw? How much does it cost? That sounds like a pretty good deal. I’m in the UK but don’t mind signing up with a French provider for this privilege,2,Which network/data plan is this btw? How much does it cost? That sounds like a pretty good deal. I’m in the UK but don’t mind signing up with a French provider for this privilege
20,2024-07-11 18:00:49,Same I was shocked that it included over 100 countries and Morocco is not amongst them.,2,Same I was shocked that it included over 100 countries and Morocco is not amongst them.
21,2024-07-12 07:08:39,That’s false. There are many other countries not included.,1,That’s false. There are many other countries not included.
22,2024-07-12 01:07:30,And that's a good thing! Having Moroccans monopolize the sector (let alone the royal family) is miles better than letting  the UAE control the crucial ISP sector + IAM needs to go away ASAP we need more competition,2,And that's a good thing! Having Moroccans monopolize the sector (let alone the royal family) is miles better than letting  the UAE control the crucial ISP sector + IAM needs to go away ASAP we need more competition
23,2024-07-12 01:05:02,Idk who will win but i m all for fights,1,Idk who will win but i m all for fights
24,2024-07-12 11:52:45,Rather have the royal family control it than UAE scums.,1,Rather have the royal family control it than UAE scums.
25,2024-07-11 16:29:33,"Chill, I’m not saying MT is innocent.",1,"Chill, I’m not saying MT is innocent."
26,2024-07-12 03:10:57,The cheikh can write a check,1,The cheikh can write a check
27,2024-07-11 16:53:53,https://mobile.free.fr/fiche-forfait-free,2,
28,2024-07-12 01:15:57,[deleted],1,[deleted]
29,2024-07-12 02:37:07,"You think this was done for the sake of ""competition""?",1,"You think this was done for the sake of ""competition""?"
30,2024-07-12 12:23:08,[deleted],1,[deleted]
31,2024-07-12 09:59:21,"Nope, but let's be honest Inwi is the least worst innovator in this sector",2,"Nope, but let's be honest Inwi is the least worst innovator in this sector"
32,2024-07-12 09:55:27,Kinda,1,Kinda
33,2024-07-12 19:42:36,"We will see about that, I have high hopes for the king, I can see that lately, he has been doing a lot of projects that benefit the country so let's be hopeful.",2,"We will see about that, I have high hopes for the king, I can see that lately, he has been doing a lot of projects that benefit the country so let's be hopeful."
34,2024-07-12 10:42:20,[deleted],1,[deleted]
35,2024-07-12 12:33:52,"Yes there is! billing per second was introduced by Inwi in the early 2010's, Win by Inwi was a big thing when it released in 2020 and it still the best bang for the buck",1,"Yes there is! billing per second was introduced by Inwi in the early 2010's, Win by Inwi was a big thing when it released in 2020 and it still the best bang for the buck"
1,2024-07-13 21:44:32,"
Welcome to r/Morocco! Please always make sure to take the time to [read the rules](https://www.reddit.com/r/morocco/wiki/rules) of this community, follow them and help us enforce them by reporting offenders. And remember that we have a zero tolerance policy for non-civil discourse and offenders risk being permanently banned.

[Don't forget to join the Discord server!](https://discord.gg/rmorocco)

**Important Notice:** Please note that the Discord channel's moderation team functions autonomously from the Reddit team. The Discord server does not extend our community guidelines and maintains a separate set of rules unrelated to those of Reddit.

Enjoy your time!


*I am a bot, and this action was performed automatically. Please [contact the moderators of this subreddit](/message/compose/?to=/r/Morocco) if you have any questions or concerns.*",1,"
Welcome to r/Morocco! Please always make sure to take the time to [read the rules]( of this community, follow them and help us enforce them by reporting offenders. And remember that we have a zero tolerance policy for non-civil discourse and offenders risk being permanently banned.

[Don't forget to join the Discord server!](

**Important Notice** Please note that the Discord channel's moderation team functions autonomously from the Reddit team. The Discord server does not extend our community guidelines and maintains a separate set of rules unrelated to those of Reddit.

Enjoy your time!


*I am a bot, and this action was performed automatically. Please [contact the moderators of this subreddit](/message/compose/?to=/r/Morocco) if you have any questions or concerns.*"
2,2024-07-13 21:53:56,"Niggas be using ADSL wondering why their internet is slow and ping is high, get fiber, Maroc Teleocm has been good for me",5,"Niggas be using ADSL wondering why their internet is slow and ping is high, get fiber, Maroc Teleocm has been good for me"
3,2024-07-13 23:00:04,"Maroc Telecom has very good customer service. I had internet problems once. One call and they fixed everything on the spot and their infrastructure keep improving. It has been since pre-covid that there has been any internet connection and even then it was rare.

I am gaming with 60-75 ping on a league of legend of game in EUW servers. These days with no fiber at all.",2,"Maroc Telecom has very good customer service. I had internet problems once. One call and they fixed everything on the spot and their infrastructure keep improving. It has been since pre-covid that there has been any internet connection and even then it was rare.

I am gaming with 60-75 ping on a league of legend of game in EUW servers. These days with no fiber at all."
4,2024-07-13 21:53:52,"I recommend 20mb ORANGE fiber for 250 Mad/month, but first check if the service is available in ur neighborhood.
we've been using it for a year now and it's great.",1,"I recommend 20mb ORANGE fiber for 250 Mad/month, but first check if the service is available in ur neighborhood.
we've been using it for a year now and it's great."
5,2024-07-14 08:24:24,You need fiber.,1,You need fiber.
6,2024-07-14 07:23:41,"what is this trend of calling internet access WiFi? it's just a lil thing that I shouldn't care about, but for some reason it really makes me cringe every time someone refer to internet as WiFi lol",1,"what is this trend of calling internet access WiFi? it's just a lil thing that I shouldn't care about, but for some reason it really makes me cringe every time someone refer to internet as WiFi lol"
7,2024-08-19 16:05:56,Bro 500 mad for 100 mbps hell no,1,Bro 500 mad for 100 mbps hell no
8,2024-07-14 19:31:33,We had a wifi prob it took them  4-5 days to solve it  the phone service told us to go to the agency only then after a day they sent someone,1,We had a wifi prob it took them  4-5 days to solve it  the phone service told us to go to the agency only then after a day they sent someone
