comment_order,comment_date,comment_text,comment_likes,cleaned_comment_text
35,2024-07-07 11:58:12,"You can definitely do it on your own with some planning!

I haven't been to that region, but I just went to Japan (first trip to Asia), and it felt super easy and safe as a solo female traveler, in addition to being an awesome place to visit. I'd traveled a lot in Latin America before (and some in Europe and Africa) -- mostly great experiences, but sometimes a bit more challenging and chaotic.

In addition to this and various other Reddit groups, there are Facebook groups like ""Girls Love Travel"" and I'm sure others, where you can post and plan to meet up with locals or people traveling to the places you're going (sounds similar to that TripBFF app).

I also like getting private rooms in hostels (especially ones with cafes/restaurants), so I have my own space but then it's more conducive to meeting other people too.",1,"You can definitely do it on your own with some planning!

I haven't been to that region, but I just went to Japan (first trip to Asia), and it felt super easy and safe as a solo female traveler, in addition to being an awesome place to visit. I'd traveled a lot in Latin America before (and some in Europe and Africa) -- mostly great experiences, but sometimes a bit more challenging and chaotic.

In addition to this and various other Reddit groups, there are Facebook groups like ""Girls Love Travel"" and I'm sure others, where you can post and plan to meet up with locals or people traveling to the places you're going (sounds similar to that TripBFF app).

I also like getting private rooms in hostels (especially ones with cafes/restaurants), so I have my own space but then it's more conducive to meeting other people too."
36,2024-09-07 23:50:41,"I've been to Georgia (Tbilisi, Kazbegi, Vardzia, and Signagi) and Azerbaijan (sadly just Baku and Qobustan - with the latter being a day trip). Feel free to reach out if you have any questions about that region.",1,"I've been to Georgia (Tbilisi, Kazbegi, Vardzia, and Signagi) and Azerbaijan (sadly just Baku and Qobustan - with the latter being a day trip). Feel free to reach out if you have any questions about that region."
1,2024-06-30 15:56:39,"
Welcome to r/Morocco! Please always make sure to take the time to [read the rules](https://www.reddit.com/r/morocco/wiki/rules) of this community, follow them and help us enforce them by reporting offenders. And remember that we have a zero tolerance policy for non-civil discourse and offenders risk being permanently banned.

[Don't forget to join the Discord server!](https://discord.gg/rmorocco)

**Important Notice:** Please note that the Discord channel's moderation team functions autonomously from the Reddit team. The Discord server does not extend our community guidelines and maintains a separate set of rules unrelated to those of Reddit.

Enjoy your time!


*I am a bot, and this action was performed automatically. Please [contact the moderators of this subreddit](/message/compose/?to=/r/Morocco) if you have any questions or concerns.*",1,"
Welcome to r/Morocco! Please always make sure to take the time to [read the rules]( of this community, follow them and help us enforce them by reporting offenders. And remember that we have a zero tolerance policy for non-civil discourse and offenders risk being permanently banned.

[Don't forget to join the Discord server!](

**Important Notice** Please note that the Discord channel's moderation team functions autonomously from the Reddit team. The Discord server does not extend our community guidelines and maintains a separate set of rules unrelated to those of Reddit.

Enjoy your time!


*I am a bot, and this action was performed automatically. Please [contact the moderators of this subreddit](/message/compose/?to=/r/Morocco) if you have any questions or concerns.*"
2,2024-06-30 16:56:38,Khdam f Asia 150 dh tal 200 dh lchher fiber wassel 60 mb/s. Mgharba saktin 3la kolchi wa kayn i7tikar dyal maroc Telecom.,48,Khdam f Asia 150 dh tal 200 dh lchher fiber wassel 60 mb/s. Mgharba saktin 3la kolchi wa kayn i7tikar dyal maroc Telecom.
3,2024-06-30 17:35:19,"cheffara mdewrin monopole binathom, layakhd fihom l7a9. chefra w makaynch li idaf3 3la 79ek",34,"cheffara mdewrin monopole binathom, layakhd fihom l7a9. chefra w makaynch li idaf3 3la 79ek"
4,2024-06-30 19:13:03,"Jbtiha hia hadik fach glti bhal connex d'ADSL, hhh, hrbtih lia, dakchi kan bl kb/s. Ach hadir a khoya rah kolchi kay3ani hadi 3amayn makayn halkawarit mn ga3 nawa7i, réseaux, makla, jafaf, kawarit tabi3ia, 9awanin dalima, dolm. Khoya ntlbo lah yr7mna wi njina wi fajiha 3l jami3, wla y3awn kola wa7d, lmochkil lkbir khwalati bjoj asatida jami3yin wo kaygolo lihom igado dakchi wistoh f24h m3a had lwifi. Dakchi s3ib sara7a. Lfasad ktr akhay",9,"Jbtiha hia hadik fach glti bhal connex d'ADSL, hhh, hrbtih lia, dakchi kan bl kb/s. Ach hadir a khoya rah kolchi kay3ani hadi 3amayn makayn halkawarit mn ga3 nawa7i, réseaux, makla, jafaf, kawarit tabi3ia, 9awanin dalima, dolm. Khoya ntlbo lah yr7mna wi njina wi fajiha 3l jami3, wla y3awn kola wa7d, lmochkil lkbir khwalati bjoj asatida jami3yin wo kaygolo lihom igado dakchi wistoh f24h m3a had lwifi. Dakchi s3ib sara7a. Lfasad ktr akhay"
5,2024-06-30 19:44:44,Nfs problème dayrin tesalat 250dh lchher kna kanhsu brasna ha mqulbin db 2mois bdlnaah l fibre. Zhma ykun tahasun ms kayn ferq ghir chwya w blil mra mra katqtae cnx. Rah mn worst connection hya li endna f maghrib mdr,6,Nfs problème dayrin tesalat 250dh lchher kna kanhsu brasna ha mqulbin db 2mois bdlnaah l fibre. Zhma ykun tahasun ms kayn ferq ghir chwya w blil mra mra katqtae cnx. Rah mn worst connection hya li endna f maghrib mdr
6,2024-07-01 01:09:36,BZAAAAF,5,BZAAAAF
7,2024-06-30 16:27:07,"maytl3ch lik dem al3ayel, sir t9eda chi  comira b kalienti",13,"maytl3ch lik dem al3ayel, sir t9eda chi  comira b kalienti"
8,2024-06-30 16:58:24,Maroc telecom ?,2,Maroc telecom ?
9,2024-06-30 20:57:42,"The best option available i think is CPE , you can buy an orange cpe and buy an cart for business even if you don't have a business , you can buy one from an orange Brokers there's too many of them out there just , search on FB marketplace about orange cpe the price goes between 500dh and 700dh , than you have two options the first one 12 Mb/s cart for 250 dh every month , 
or 30 Mb/s for 350dh 
In my experience with orange cpe, i have a friend who has an orange dar box when you give me the router to try it on my house it was sh$t i test the speed on fast.com it's only 100kb/s but when i tried orange cpe with 30 Mb/s the lowest can do is 90Mb/s 
"" I live in rural places and i am really satisfied with orange CPE i think INWI also has this kind of service just take a look on YouTube you will find more detailed videos that could help you",2,"The best option available i think is CPE , you can buy an orange cpe and buy an cart for business even if you don't have a business , you can buy one from an orange Brokers there's too many of them out there just , search on FB marketplace about orange cpe the price goes between 500dh and 700dh , than you have two options the first one 12 Mb/s cart for 250 dh every month , 
or 30 Mb/s for 350dh 
In my experience with orange cpe, i have a friend who has an orange dar box when you give me the router to try it on my house it was sh$t i test the speed on fast.com it's only 100kb/s but when i tried orange cpe with 30 Mb/s the lowest can do is 90Mb/s 
"" I live in rural places and i am really satisfied with orange CPE i think INWI also has this kind of service just take a look on YouTube you will find more detailed videos that could help you"
10,2024-06-30 17:53:48,Yalh baghi ndkhelha ach hadd khal3aa akhouya !!!,1,Yalh baghi ndkhelha ach hadd khal3aa akhouya !!!
11,2024-06-30 18:01:47,Nadi reseau o lwifi a3wam homa b3d lmrat kitra mochkil ms kikon mn charika kikon m9t3lihom chi khayt wla chi haja mra f l3am wla b3d lmrat ga3ma kayn had lmochkil bdl adsl dir fibre,1,Nadi reseau o lwifi a3wam homa b3d lmrat kitra mochkil ms kikon mn charika kikon m9t3lihom chi khayt wla chi haja mra f l3am wla b3d lmrat ga3ma kayn had lmochkil bdl adsl dir fibre
12,2024-06-30 18:07:40,hna f dar d 3a2ila ba mkhales ghi 200dh mfere9 3la 4 etages o khadam mezyan kantfarej bih f tv khadam mezyan.  (tanger ) walakin dar dyalna f casa makhadmchi mezyan kandon wakila blassa li ntina saken fiha wach 3amra wla khawya.,1,hna f dar d 3a2ila ba mkhales ghi 200dh mfere9 3la 4 etages o khadam mezyan kantfarej bih f tv khadam mezyan.  (tanger ) walakin dar dyalna f casa makhadmchi mezyan kandon wakila blassa li ntina saken fiha wach 3amra wla khawya.
13,2024-06-30 18:28:52,wa diro la fibre,1,wa diro la fibre
14,2024-06-30 19:09:27,"ADSL is dead , they are forcing everyone to go to fiber or 4G",1,"ADSL is dead , they are forcing everyone to go to fiber or 4G"
15,2024-06-30 19:10:02,"Ila kan réseau dyal inwi 3iyan 3ndk f derb wla f dar ra lwifi tahouwa ma3ndk madir, mn ghir tjrb ga3 les cartes f tel dyalk w tchouf achmn w7da khdama mzyan w tal3 réseau mzyan dik ghatgoul l inwi bslama w dir li lwifi dyal li khdama mzyan

Wl wifi sara7a kan 3ndi adsl iam l3adab chadid, gha kaytflaw 3la bnadm bih, mn l a7san chouf lik fibre orange wach dayza 3ndkom f derb ra 250dh tjib fibre 20mb w 7sen bzaaaaaf mn adsl w ga3 labghiti tzid tal 350dh ra kayna dyal 50mb w mkhayra f le3b ping habt w ta f download ra 5mb/s 7nina 

W ila makhdmat ta w7da 7awl matketerch mn dwa dyal 7ri9 ras alkhawa dyali ra mamzyanch lkbda",1,"Ila kan réseau dyal inwi 3iyan 3ndk f derb wla f dar ra lwifi tahouwa ma3ndk madir, mn ghir tjrb ga3 les cartes f tel dyalk w tchouf achmn w7da khdama mzyan w tal3 réseau mzyan dik ghatgoul l inwi bslama w dir li lwifi dyal li khdama mzyan

Wl wifi sara7a kan 3ndi adsl iam l3adab chadid, gha kaytflaw 3la bnadm bih, mn l a7san chouf lik fibre orange wach dayza 3ndkom f derb ra 250dh tjib fibre 20mb w 7sen bzaaaaaf mn adsl w ga3 labghiti tzid tal 350dh ra kayna dyal 50mb w mkhayra f le3b ping habt w ta f download ra 5mb/s 7nina 

W ila makhdmat ta w7da 7awl matketerch mn dwa dyal 7ri9 ras alkhawa dyali ra mamzyanch lkbda"
16,2024-06-30 19:12:51,"makaynch la fibre 3andek felbatima ? rah kadir 7tahiya nefs taman
jereb la box 4g rah ba3d lmerat katsd9 7sen men l'adsl",1,"makaynch la fibre 3andek felbatima ? rah kadir 7tahiya nefs taman
jereb la box 4g rah ba3d lmerat katsd9 7sen men l'adsl"
17,2024-06-30 19:25:11,ana frbat o lmochkila ta3ek kant 3ndi b9it tan 3iyet l maroc telecom chi 1000 mera 3aaad jaw o gado liya mochkilti,1,ana frbat o lmochkila ta3ek kant 3ndi b9it tan 3iyet l maroc telecom chi 1000 mera 3aaad jaw o gado liya mochkilti
18,2024-06-30 19:56:13,"Ana dert fibre d 100MB d Maroc Telecom bach thennit. If you can afford it, go for it",1,"Ana dert fibre d 100MB d Maroc Telecom bach thennit. If you can afford it, go for it"
19,2024-06-30 20:22:42,"3ndk sah
Even fibre optique isnt that good",1,"3ndk sah
Even fibre optique isnt that good"
20,2024-06-30 21:24:24,Wa nare shabli GHa ana rah maymknch galik fibre optique lah ilgiha lihom,1,Wa nare shabli GHa ana rah maymknch galik fibre optique lah ilgiha lihom
21,2024-06-30 21:41:33,"I lost many jobs offer due to this , jrabt nzid f debit jrabt nmchi l9hawi lblayes fehum wifi tyara and yet walo , Had l3am kan khayeb bzaf mna7iyat connection.",1,"I lost many jobs offer due to this , jrabt nzid f debit jrabt nmchi l9hawi lblayes fehum wifi tyara and yet walo , Had l3am kan khayeb bzaf mna7iyat connection."
22,2024-06-30 21:45:50,Good internet in Morocco u need to have fibre optique,1,Good internet in Morocco u need to have fibre optique
23,2024-06-30 21:52:50,Les offres lwahidin li mezianin f mghrib kibdaw mn 250 end orange li machi ahssan haja tal la fibre d maroc telecom b 500 o 1000 ta 4g dial gae les conpagnies kamlin arnaque cnx katmchi lik ki lbrd alors que d autres pays 80go katchd biha chher kaml mfrj f ytb netflix b ahssan qualite 4g h24 mtloqa o tchiyt mnha,1,Les offres lwahidin li mezianin f mghrib kibdaw mn 250 end orange li machi ahssan haja tal la fibre d maroc telecom b 500 o 1000 ta 4g dial gae les conpagnies kamlin arnaque cnx katmchi lik ki lbrd alors que d autres pays 80go katchd biha chher kaml mfrj f ytb netflix b ahssan qualite 4g h24 mtloqa o tchiyt mnha
24,2024-06-30 22:13:34,your wifi code please,1,your wifi code please
25,2024-06-30 22:41:02,"Assalamu Alaikum wa rahmatu Allah wa barakatuh,


Blasa li kheddam fiha ana connection mziana. 

-Y9der ykoun mouchkil mn router. 
-Wach f'ga3' devices had l'mouchkil 3endek?


Do some troubleshooting, try to optimize your devices. Sometimes they are not configured correctly, or they do act out after an update. If after doing some troubleshooting the problem persists, contact your internet provider.",1,"Assalamu Alaikum wa rahmatu Allah wa barakatuh,


Blasa li kheddam fiha ana connection mziana. 

-Y9der ykoun mouchkil mn router. 
-Wach f'ga3' devices had l'mouchkil 3endek?


Do some troubleshooting, try to optimize your devices. Sometimes they are not configured correctly, or they do act out after an update. If after doing some troubleshooting the problem persists, contact your internet provider."
26,2024-06-30 22:56:08,La anak lha9 ana ri had 4 chhora la5ra ana o dar jadi o 3 dyal jirana li badlo adsl maroc telecom 12 o daro l Fibre 100. Hit dik 12 mg walat 5adama b slow motion. Adna f dar mbliyin b kora o l matchat o dik 12 mg had l3am walat mayta o bezaf chthom ya 5dam 100 maroc telecom wla Fibre 20 wla 50 dyal orange.,1,La anak lha9 ana ri had 4 chhora la5ra ana o dar jadi o 3 dyal jirana li badlo adsl maroc telecom 12 o daro l Fibre 100. Hit dik 12 mg walat 5adama b slow motion. Adna f dar mbliyin b kora o l matchat o dik 12 mg had l3am walat mayta o bezaf chthom ya 5dam 100 maroc telecom wla Fibre 20 wla 50 dyal orange.
27,2024-06-30 23:09:05,Eda konti f Tanja rah chhar w connection adsl 250dh me9tola w kat9ta3 3yit man3aytlom walo akhir appel 9aloli Kayn installation d Fibre katkhales rir 500dh fhamt bli kay3mloha bel3ani wlad nas Bach tswetchi l Fibre,1,Eda konti f Tanja rah chhar w connection adsl 250dh me9tola w kat9ta3 3yit man3aytlom walo akhir appel 9aloli Kayn installation d Fibre katkhales rir 500dh fhamt bli kay3mloha bel3ani wlad nas Bach tswetchi l Fibre
28,2024-06-30 23:13:21,"Ana orange fcasa kan mkhyr vraoment top notch since 2021 21/22mbps
Db mn dec ou ana 9ate3 lgaming 7it lping unstable asfffff mymkench ga3 t9esser ou debit hbet mn 21-22 chi merrat kan ga3 taywsel 30 db wella 17-16mbps ou lping unplayable",1,"Ana orange fcasa kan mkhyr vraoment top notch since 2021 21/22mbps
Db mn dec ou ana 9ate3 lgaming 7it lping unstable asfffff mymkench ga3 t9esser ou debit hbet mn 21-22 chi merrat kan ga3 taywsel 30 db wella 17-16mbps ou lping unplayable"
29,2024-07-01 01:07:31,Bruh inwi is shit ima tisalat ima orange,1,Bruh inwi is shit ima tisalat ima orange
30,2024-07-01 05:02:50,"Inwi wlad 97 masd9osh, orange hsen menhom",1,"Inwi wlad 97 masd9osh, orange hsen menhom"
31,2024-07-01 05:03:32,Call me stupid kankhls 3la wifi 3adi 250 dh wkayn fibre b250 dh soo is it gone be better douuuubt its all trash,1,Call me stupid kankhls 3la wifi 3adi 250 dh wkayn fibre b250 dh soo is it gone be better douuuubt its all trash
32,2024-07-01 08:40:55,"Machii gha tina htayana, wlkin akhawa kanfra3lihom karhom yawmiyan bach yjiw y3adloha wakha hakak t9ila",1,"Machii gha tina htayana, wlkin akhawa kanfra3lihom karhom yawmiyan bach yjiw y3adloha wakha hakak t9ila"
33,2024-07-01 08:45:58,nefss l7aja m3a 4G dial inwi hadak houa sokkar dial bssah 😔😔,1,nefss l7aja m3a 4G dial inwi hadak houa sokkar dial bssah 
34,2024-07-01 08:54:40,![gif](giphy|BbJdwrOsM7nTa|downsized),1,![gif](giphy|BbJdwrOsM7nTa|downsized)
35,2024-07-01 09:06:31,Always been,1,Always been
36,2024-07-01 10:00:45,"Lmgharba saktin, o Consumer Protection department madayrinch khdamthom o katrarjo flmgharba",1,"Lmgharba saktin, o Consumer Protection department madayrinch khdamthom o katrarjo flmgharba"
37,2024-07-01 10:13:46,"Elik b orange, they promise they deliver.",1,"Elik b orange, they promise they deliver."
38,2024-07-01 11:01:12,"Taf Benslimane catastrophe kantbahdle bache ikhdam liya YouTube, sa3a daba Kina évolution walaw i9at3o tadaw 🤦‍♂️",1,"Taf Benslimane catastrophe kantbahdle bache ikhdam liya YouTube, sa3a daba Kina évolution walaw i9at3o tadaw 🤦"
39,2024-07-01 11:03:00,عيط لهم و طلب منهم ان يتدخلون في المنزل لإصلاح المشكل .، انا نفس المشكل   و لما تدخلوا لم يبقى مشكل .تلات ايام و انا اطلبهم حتى أتوا.,1,عيط لهم و طلب منهم ان يتدخلون في المنزل لإصلاح المشكل .، انا نفس المشكل   و لما تدخلوا لم يبقى مشكل .تلات ايام و انا اطلبهم حتى أتوا.
40,2024-07-01 11:24:56,We living in the same pain RA mymkensh sh7al wela t9il...khdama b WIFI dyal Maroc Télécom w mkhrej fiya l a3sab shi 3er9 aytrt9 fiya...w zid 3liha kyjih ykhser rie fash kan7tajo the most for school things ughhh..,1,We living in the same pain RA mymkensh sh7al wela t9il...khdama b WIFI dyal Maroc Télécom w mkhrej fiya l a3sab shi 3er9 aytrt9 fiya...w zid 3liha kyjih ykhser rie fash kan7tajo the most for school things ughhh..
41,2024-07-01 11:51:39,"Inwi is trash 
Try other companies services when it comes to FIBRE.",1,"Inwi is trash 
Try other companies services when it comes to FIBRE."
42,2024-07-01 11:55:04,Ana 3ndi fibre Orange 20 o kan dima mzyan ila lhad chhora lekhrin wla bhal lkhra bghit nbdl lchi tisalat khorain wlkn m3rftch,1,Ana 3ndi fibre Orange 20 o kan dima mzyan ila lhad chhora lekhrin wla bhal lkhra bghit nbdl lchi tisalat khorain wlkn m3rftch
43,2024-07-01 12:11:59,Awdiii khddamin b fibre 100 mega w lcnx ma'awda 3liha tbfh.,1,Awdiii khddamin b fibre 100 mega w lcnx ma'awda 3liha tbfh.
44,2024-07-01 15:39:46,"Details

Plan charge will be automatically deducted every 30 days from your account balance. Taxes extra.

Talk & Text: Includes unlimited talk and text within and between the U.S., Mexico & Canada and unlimited text from the U.S. to over 230 countries. For the list of countries available for texting from the U.S., go to att.com/prepaidintltext.

International calling from the U.S.: Includes 500 minutes of International Long Distance calling from the U.S. to over 30 countries. After 500 minutes, pay-per-use rates apply. See att.com/UnlMaxPlusILD for details.

Data: Includes unlimited data usage in the U.S. and Mexico. In Canada, if you exceed 25 GB of data usage in a monthly plan period, speeds will be reduced to 512 Kbps for the remainder of the period. 2G off-net data speeds may apply. See att.com/broadbandinfo for details on AT&T network management policies.

Mobile Hotspot: Requires compatible device. Includes 35 GB of high-speed mobile hotspot/tethering data per monthly plan period in the U.S. After 35 GB, tethering slowed to a max speed of 128 Kbps for the rest of the monthly plan period. At this speed, hotspot use will not fully function.

5G Access: Requires a compatible device and is not available everywhere. See att.com/5Gforyou for details.

Personal Cloud: AT&T Personal Cloud 100GB is included with your plan. The Personal Cloud app provides a way to safely store and protect valuable mobile content in the cloud. Through the app, customers can backup, sync, restore, access, create, and share content. For more info go to att.com/prepaidcloud.

Video Streaming: Plan includes the Video Management feature. We aim to render streaming video in standard-definition (max speed of 2 Mbps for customers on both a 5G compatible device and rate plan, or 1.5 Mbps for other customers) though some video cannot be identified. Sometimes, other content that content providers bundle with streaming video may be impacted and slowed, including downloads. In certain situations, we may deliver video content faster or at higher definition. To experience higher definition video when available, or if you have an issue, turn the feature off or back on any time at att.com/myprepaid. Details at att.com/VideoFeature.

Family Plan: Plan eligible for enrollment in Multi-Line account. Account owner is responsible for paying monthly plan charges for all lines. Additional terms and restrictions apply. See att.com/prepaidfamily for details.

HD Voice: Where available and with compatible device. See att.com/hdvoice for details.

Wi-Fi Calling: Requires compatible device and active Wi-Fi connection. See att.com/wificalling for details.

AT&T ActiveArmor: Requires app download, compatible device/service. Data charges may apply. Call Routing Settings, including fraud and spam risk blocking, may inadvertently block wanted calls; settings can be adjusted in app. Some mobile features are not available while roaming internationally. Details at att.com/activearmorapp.

Limits: Max 5 devices per account. Not combinable with certain other offers. For more details on coverage area availability, charges, restrictions and conditions, go to http://att.com/myprepaid.

General: By activating/using AT&T Prepaid service, you agree to the AT&T Consumer Service Agreement at att.com/ConsumerServiceAgreement. Account will be canceled unless you add money within 26 days of activation. Active service requires account payment in full for monthly plans.Monthly plans: Calls to special and premium services may be blocked. Service cannot be resold or used for fraudulent purposes. Geographic, usage, and other terms, conditions, and restrictions apply. Taxes and other charges may apply. See http://att.com/prepaid for details. Plans subject to change and may be changed or discontinued at any time without notice. Service is subject to AT&T’s network management policies, see att.com/broadbandinfo for details
——-/
550 dh a month",1,"Details

Plan charge will be automatically deducted every 30 days from your account balance. Taxes extra.

Talk & Text Includes unlimited talk and text within and between the U.S., Mexico & Canada and unlimited text from the U.S. to over 230 countries. For the list of countries available for texting from the U.S., go to att.com/prepaidintltext.

International calling from the U.S. Includes 500 minutes of International Long Distance calling from the U.S. to over 30 countries. After 500 minutes, pay-per-use rates apply. See att.com/UnlMaxPlusILD for details.

Data Includes unlimited data usage in the U.S. and Mexico. In Canada, if you exceed 25 GB of data usage in a monthly plan period, speeds will be reduced to 512 Kbps for the remainder of the period. 2G off-net data speeds may apply. See att.com/broadbandinfo for details on AT&T network management policies.

Mobile Hotspot Requires compatible device. Includes 35 GB of high-speed mobile hotspot/tethering data per monthly plan period in the U.S. After 35 GB, tethering slowed to a max speed of 128 Kbps for the rest of the monthly plan period. At this speed, hotspot use will not fully function.

5G Access Requires a compatible device and is not available everywhere. See att.com/5Gforyou for details.

Personal Cloud AT&T Personal Cloud 100GB is included with your plan. The Personal Cloud app provides a way to safely store and protect valuable mobile content in the cloud. Through the app, customers can backup, sync, restore, access, create, and share content. For more info go to att.com/prepaidcloud.

Video Streaming Plan includes the Video Management feature. We aim to render streaming video in standard-definition (max speed of 2 Mbps for customers on both a 5G compatible device and rate plan, or 1.5 Mbps for other customers) though some video cannot be identified. Sometimes, other content that content providers bundle with streaming video may be impacted and slowed, including downloads. In certain situations, we may deliver video content faster or at higher definition. To experience higher definition video when available, or if you have an issue, turn the feature off or back on any time at att.com/myprepaid. Details at att.com/VideoFeature.

Family Plan Plan eligible for enrollment in Multi-Line account. Account owner is responsible for paying monthly plan charges for all lines. Additional terms and restrictions apply. See att.com/prepaidfamily for details.

HD Voice Where available and with compatible device. See att.com/hdvoice for details.

Wi-Fi Calling Requires compatible device and active Wi-Fi connection. See att.com/wificalling for details.

AT&T ActiveArmor Requires app download, compatible device/service. Data charges may apply. Call Routing Settings, including fraud and spam risk blocking, may inadvertently block wanted calls; settings can be adjusted in app. Some mobile features are not available while roaming internationally. Details at att.com/activearmorapp.

Limits Max 5 devices per account. Not combinable with certain other offers. For more details on coverage area availability, charges, restrictions and conditions, go to 

General By activating/using AT&T Prepaid service, you agree to the AT&T Consumer Service Agreement at att.com/ConsumerServiceAgreement. Account will be canceled unless you add money within 26 days of activation. Active service requires account payment in full for monthly plans.Monthly plans Calls to special and premium services may be blocked. Service cannot be resold or used for fraudulent purposes. Geographic, usage, and other terms, conditions, and restrictions apply. Taxes and other charges may apply. See  for details. Plans subject to change and may be changed or discontinued at any time without notice. Service is subject to AT&T’s network management policies, see att.com/broadbandinfo for details
——-/
550 dh a month"
45,2024-07-01 16:25:36,Ki lkhra wlat 7ashak,1,Ki lkhra wlat 7ashak
