comment_order,comment_date,comment_text,comment_likes,cleaned_comment_text
1,2024-11-21 17:28:19,"
Welcome to r/Morocco! Please always make sure to take the time to [read the rules](https://www.reddit.com/r/morocco/wiki/rules) of this community, follow them and help us enforce them by reporting offenders. And remember that we have a zero tolerance policy for non-civil discourse and offenders risk being permanently banned.

[Don't forget to join the Discord server!](https://discord.gg/rmorocco)

**Important Notice:** Please note that the Discord channel's moderation team functions autonomously from the Reddit team. The Discord server does not extend our community guidelines and maintains a separate set of rules unrelated to those of Reddit.

Enjoy your time!


*I am a bot, and this action was performed automatically. Please [contact the moderators of this subreddit](/message/compose/?to=/r/Morocco) if you have any questions or concerns.*",1,"
Welcome to r/Morocco! Please always make sure to take the time to [read the rules]( of this community, follow them and help us enforce them by reporting offenders. And remember that we have a zero tolerance policy for non-civil discourse and offenders risk being permanently banned.

[Don't forget to join the Discord server!](

**Important Notice** Please note that the Discord channel's moderation team functions autonomously from the Reddit team. The Discord server does not extend our community guidelines and maintains a separate set of rules unrelated to those of Reddit.

Enjoy your time!


*I am a bot, and this action was performed automatically. Please [contact the moderators of this subreddit](/message/compose/?to=/r/Morocco) if you have any questions or concerns.*"
2,2024-11-21 17:37:09,"i have it for a looong time, since they started, i used to game with it.

for the first 2 years it was probably the best internet provider i have ever used, veeery stable, zero problems.

and than they decided to change something, ping is all over the place, packet loss is more like a bitcoin chart.

i still use it but mainly when im not near a stable wifi.

15gb&1hour for 50dhs is a very good deal for me",13,"i have it for a looong time, since they started, i used to game with it.

for the first 2 years it was probably the best internet provider i have ever used, veeery stable, zero problems.

and than they decided to change something, ping is all over the place, packet loss is more like a bitcoin chart.

i still use it but mainly when im not near a stable wifi.

15gb&1hour for 50dhs is a very good deal for me"
3,2024-11-21 17:44:16,"Chfara, drt abonnement 3ndhom b 79dh, wslatni simcard l dar walakin kan fiha mochkil. Drt réclamation w glt lihom bli Brit n 7yd contrat w rj3o lia flossi bqaw kayjrjro fia 2 ans Tal daba ma chft mnhom walo. Mn had lminbar lah in3l lihom lwalidin",13,"Chfara, drt abonnement 3ndhom b 79dh, wslatni simcard l dar walakin kan fiha mochkil. Drt réclamation w glt lihom bli Brit n 7yd contrat w rj3o lia flossi bqaw kayjrjro fia 2 ans Tal daba ma chft mnhom walo. Mn had lminbar lah in3l lihom lwalidin"
4,2024-11-21 18:53:23,I have been a customer of Win for more than four years now. Never had one single problem.,5,I have been a customer of Win for more than four years now. Never had one single problem.
5,2024-11-21 17:42:49,"Pro: the deal is real, it's the cheapest mobile data (15GB and 1h of talk for 50dh) and mostly performs well. If you use up your monthly data, you can seamlessly move into the next package as if you had bought it at the beginning of the month, which is really nice! Speeds are satisfactory when the network doesn't hang. 

Con: at times unreliable: WhatsApp calls and messages don't come through, everything takes 10 seconds to load instead of tenth of a second, and sometimes it absolutely refuses to work with my VPN. Very frustrating. 

When this month ends I'll go back to IAM for 5GB/50dh to see if the performance is more reliable, since most of the time I didn't even use more than 5GB. Since it is month by month, it's no problem.",3,"Pro the deal is real, it's the cheapest mobile data (15GB and 1h of talk for 50dh) and mostly performs well. If you use up your monthly data, you can seamlessly move into the next package as if you had bought it at the beginning of the month, which is really nice! Speeds are satisfactory when the network doesn't hang. 

Con at times unreliable WhatsApp calls and messages don't come through, everything takes 10 seconds to load instead of tenth of a second, and sometimes it absolutely refuses to work with my VPN. Very frustrating. 

When this month ends I'll go back to IAM for 5GB/50dh to see if the performance is more reliable, since most of the time I didn't even use more than 5GB. Since it is month by month, it's no problem."
6,2024-11-21 18:55:14,"The price compared with what you get is a good value, however they have one of the worst and quite scary customer support i’ve ever seen..

So basically one day i had a problem with my internet so i reach out to them to solve it.

At first everything was normal, they asked me their usual useless questions like what’s my email and name and stuff….

We talked a bit but it was all in vain, they told me that my request is sent to the department of something like they always do
The scary part is the following, after some time of talking I realized that the typing animation appeared for quite a while(a solid 30-40 seconds) and no message was sent by them, and out of curiosity I looked at my front camera and i did the ✌🏻sign just for fun, then a paragraph appeared and disappeared so quickly, and all my eyes could catch from that paragraph is:
( Mr Houssaine dok joj sba3……) 
I immediately shutdown my phone, my heart sank, I couldn’t believe it, how tf a company that provides telecom services can spy on people like that.

It’s unacceptable and illegal, what guarantees that they’re not spying on you right now reading this
Seeing what you’re doing, and hearing what you’re saying.

This is tough people, turn off camera access from any application you have on your phone as well as microphone.

Go watch a tutorial if you don’t know how, make sometime for your own privacy, god knows what these monsters can do with your informations.
Stay safe my friend.",2,"The price compared with what you get is a good value, however they have one of the worst and quite scary customer support i’ve ever seen..

So basically one day i had a problem with my internet so i reach out to them to solve it.

At first everything was normal, they asked me their usual useless questions like what’s my email and name and stuff….

We talked a bit but it was all in vain, they told me that my request is sent to the department of something like they always do
The scary part is the following, after some time of talking I realized that the typing animation appeared for quite a while(a solid 30-40 seconds) and no message was sent by them, and out of curiosity I looked at my front camera and i did the sign just for fun, then a paragraph appeared and disappeared so quickly, and all my eyes could catch from that paragraph is
( Mr Houssaine dok joj sba3……) 
I immediately shutdown my phone, my heart sank, I couldn’t believe it, how tf a company that provides telecom services can spy on people like that.

It’s unacceptable and illegal, what guarantees that they’re not spying on you right now reading this
Seeing what you’re doing, and hearing what you’re saying.

This is tough people, turn off camera access from any application you have on your phone as well as microphone.

Go watch a tutorial if you don’t know how, make sometime for your own privacy, god knows what these monsters can do with your informations.
Stay safe my friend."
7,2024-11-21 17:38:16,"Used it from 2020 to 2023. 

They migrated my number from my former Télécom operator flawlessly and delivered the new sim card to my door step.

After that it was very nice to have the option to change the number of hours and data plan every month if I needed to. I could add more GB to my data plan or hours for calling according to what I needed to do the next month.

Payment online only failed once and then I got reimbursement.

If you don't mind inwi's network coverage, then it's probably the best way to manage your sim currently if you looking for a 100% online experience.

Disclaimer: I'm a current employee of Inwi but I wasn't at the time when I was a Win customer.",1,"Used it from 2020 to 2023. 

They migrated my number from my former Télécom operator flawlessly and delivered the new sim card to my door step.

After that it was very nice to have the option to change the number of hours and data plan every month if I needed to. I could add more GB to my data plan or hours for calling according to what I needed to do the next month.

Payment online only failed once and then I got reimbursement.

If you don't mind inwi's network coverage, then it's probably the best way to manage your sim currently if you looking for a 100% online experience.

Disclaimer I'm a current employee of Inwi but I wasn't at the time when I was a Win customer."
8,2024-11-21 18:26:54,Used it for a few months before I needed to share internet with my laptop. Realized that they somehow prevent that. Cancelled the next day and went to Maroc Telecom. Hate MT to the bones but like it or not their services & coverage are better.,1,Used it for a few months before I needed to share internet with my laptop. Realized that they somehow prevent that. Cancelled the next day and went to Maroc Telecom. Hate MT to the bones but like it or not their services & coverage are better.
9,2024-11-21 18:57:53,"I like the ability to customize your plan and pay whenever you need it, however the deal breaker for me was the internet-only customer service, like if you don't have any coverage or data you're left stranded. I was about to make the same mistake with Orange's Yoxo but I badgered them to cancel my order.",1,"I like the ability to customize your plan and pay whenever you need it, however the deal breaker for me was the internet-only customer service, like if you don't have any coverage or data you're left stranded. I was about to make the same mistake with Orange's Yoxo but I badgered them to cancel my order."
10,2024-11-21 19:15:01,Practical but not always reliable,1,Practical but not always reliable
11,2024-11-21 19:26:39,"I have been use it since they launched.. great service.. if you face any issue you contact support and they resolve it for you (only had an issue once, i bought a pass but it expired before the duration it was meant to last, contact support and they gave me more data)

The only con for me was that it was not difficult to activate a plan without internet.. you can't just go a shop and buy a refill. But they solved that and you can access they website and activate a plan even if you do not have internet on your mobile.

I would recommend",1,"I have been use it since they launched.. great service.. if you face any issue you contact support and they resolve it for you (only had an issue once, i bought a pass but it expired before the duration it was meant to last, contact support and they gave me more data)

The only con for me was that it was not difficult to activate a plan without internet.. you can't just go a shop and buy a refill. But they solved that and you can access they website and activate a plan even if you do not have internet on your mobile.

I would recommend"
12,2024-11-21 19:29:27,"I've been using it for a year or so, it's good.",1,"I've been using it for a year or so, it's good."
13,2024-11-21 19:45:35,My older brother had been using it for 3 months then he stopped it for no reason but when i asked him once he told it’s a good offer so You can try it for 1 month then if you found it bad offer just talk with costumer services to stop it for you with no interest service,1,My older brother had been using it for 3 months then he stopped it for no reason but when i asked him once he told it’s a good offer so You can try it for 1 month then if you found it bad offer just talk with costumer services to stop it for you with no interest service
14,2024-11-21 19:49:15,"I used it between 2022 and the beginning of 2024. The plans are highly customizable with pretty decent prices compared to other options, and the internet was good in some places like Agadir city
  
In contrast, it had absolute dog shit speeds in other places like Marrakech and the surrounding rural areas

i'd recommend to test it out for a month with the cheapest plan, I think it's around 50 dh. If you don’t like it, you can cancel (and you can reactivate it anytime if you change your mind)",1,"I used it between 2022 and the beginning of 2024. The plans are highly customizable with pretty decent prices compared to other options, and the internet was good in some places like Agadir city
  
In contrast, it had absolute dog shit speeds in other places like Marrakech and the surrounding rural areas

i'd recommend to test it out for a month with the cheapest plan, I think it's around 50 dh. If you don’t like it, you can cancel (and you can reactivate it anytime if you change your mind)"
15,2024-11-21 19:54:49,10/10. I had it since 2020 and i only pay 49 mad for 1 hour and 15 go of internet. Highly recommended,1,10/10. I had it since 2020 and i only pay 49 mad for 1 hour and 15 go of internet. Highly recommended
16,2024-11-21 20:05:01,"Used it for some years now, no major problems so far.",1,"Used it for some years now, no major problems so far."
17,2024-11-21 20:07:56,"Pricing is the best in the country.
Customer support is trash.",1,"Pricing is the best in the country.
Customer support is trash."
18,2024-11-21 20:26:34,"Used it for years, not a single problem so far",1,"Used it for years, not a single problem so far"
19,2024-11-21 21:17:55,"I have to SIMs, got WIN as my backup. I only pay when I need it, so it's pretty handy. 

Network is a bit meh compared to MT, but gets the job done for cheap.",1,"I have to SIMs, got WIN as my backup. I only pay when I need it, so it's pretty handy. 

Network is a bit meh compared to MT, but gets the job done for cheap."
20,2024-11-21 21:31:20,The best one. Never disappoints,1,The best one. Never disappoints
21,2024-11-21 21:36:55,"I ve been using it for 4 years, never disappoints. I did transfer my number from maroc telecom and I still have this rage in me. They used to steal my very expensive forfait. Dima mty7ini en panne when I needed solde the most 

 Win was a game changer, not only did I have flexible affordable abonnement,  I can charge via card with 4g even if I don't have a paid internet subscription and out of wifi.",1,"I ve been using it for 4 years, never disappoints. I did transfer my number from maroc telecom and I still have this rage in me. They used to steal my very expensive forfait. Dima mty7ini en panne when I needed solde the most 

 Win was a game changer, not only did I have flexible affordable abonnement,  I can charge via card with 4g even if I don't have a paid internet subscription and out of wifi."
22,2024-11-21 21:38:48,10/10,1,10/10
23,2024-11-22 05:52:38,The best saraha and its cheap hwa ola yoxo both are good,1,The best saraha and its cheap hwa ola yoxo both are good
24,2024-11-22 11:58:21,"Suck, like Yoxo, was good at first i have the 199 dhs abonnement with unlimited 4g, at first it was good till you download 50 go, you have a slower connection, but now at 20go you're limited to 56 kbs for 200 dhs it's a scam",1,"Suck, like Yoxo, was good at first i have the 199 dhs abonnement with unlimited 4g, at first it was good till you download 50 go, you have a slower connection, but now at 20go you're limited to 56 kbs for 200 dhs it's a scam"
25,2024-11-22 13:48:08,"Been using it [since the lockdown](https://blog.pingfrommorocco.com/2020/04/my-experience-with-win-by-inwi.html), no major complaints. It worked fine in Casablanca and Ifrane. It had some rare issues when I was using it in 3G mode, but it's been smooth sailing since I switched to 4G. Also fwiw, [imgur](https://blog.pingfrommorocco.com/2022/03/imgur-fails-to-load-with-inwi.html) doesn't work for some reason",1,"Been using it [since the lockdown]( no major complaints. It worked fine in Casablanca and Ifrane. It had some rare issues when I was using it in 3G mode, but it's been smooth sailing since I switched to 4G. Also fwiw, [imgur]( doesn't work for some reason"
26,2024-11-22 17:26:49,why is mobile services so expensive in Morocco? we need real competition.,1,why is mobile services so expensive in Morocco? we need real competition.
27,2024-11-21 18:04:22,"0/10. It was working fine for 4 months and then my line got disconected without any reason. And given that they dont have any physical location you can go to and complain, the problem didnt get resolved. All i could do is chat with someone on their app, each time the person is different and they say your problem is getting treated without any actual results. I tried for like 3 months and then i gave up and threw their sim card. I totally dont recommend.",1,"0/10. It was working fine for 4 months and then my line got disconected without any reason. And given that they dont have any physical location you can go to and complain, the problem didnt get resolved. All i could do is chat with someone on their app, each time the person is different and they say your problem is getting treated without any actual results. I tried for like 3 months and then i gave up and threw their sim card. I totally dont recommend."
28,2024-11-21 19:30:26,"That's true, it's very cheap, i'm using it over 2 years now",2,"That's true, it's very cheap, i'm using it over 2 years now"
29,2024-11-22 06:48:31,"Yeah, some online games can't even operate with win.
Also, weird behaviour woth whatsapp : You only receive msg if you enter app or after a long time, like if 4G has a sleep mode and do period wake ups to receive updates. ..",1,"Yeah, some online games can't even operate with win.
Also, weird behaviour woth whatsapp  You only receive msg if you enter app or after a long time, like if 4G has a sleep mode and do period wake ups to receive updates. .."
30,2024-11-21 18:08:08,Valid crash out,3,Valid crash out
31,2024-11-22 06:52:04,"Yep just said the same on a nother comment.

My main issues has been this :
1. Whatsapp
2. Few games not working with win network
3. Some corporate VPN can't connect
4. Sometimes, would struggle with DNS resolution, and forcing it to use google DNS 8.8.8.8 will result in full internet blocage


Overall it is still good value for price and the flexibility to change subscription plan is unmatched. Orange has a similar concept with YOXO but Orange coverage is just awful.",1,"Yep just said the same on a nother comment.

My main issues has been this 
1. Whatsapp
2. Few games not working with win network
3. Some corporate VPN can't connect
4. Sometimes, would struggle with DNS resolution, and forcing it to use google DNS 8.8.8.8 will result in full internet blocage


Overall it is still good value for price and the flexibility to change subscription plan is unmatched. Orange has a similar concept with YOXO but Orange coverage is just awful."
32,2024-11-21 21:21:45,"Lol, I checked the win app on play store and it actually asks for Camera/storage permission (maybe to send photo id?). Always deny permissions for apps that don't need your data.",2,"Lol, I checked the win app on play store and it actually asks for Camera/storage permission (maybe to send photo id?). Always deny permissions for apps that don't need your data."
33,2024-11-21 19:31:40,"I have the same problem with yoxo by orange, fast on my phone, super slow when i share with my laptop idk why that is, i just got it 3 days ago",2,"I have the same problem with yoxo by orange, fast on my phone, super slow when i share with my laptop idk why that is, i just got it 3 days ago"
34,2024-11-21 19:01:37,Wdym they prevent that? How on earth can they do that? You can do whatever you want with your internet lmfao,1,Wdym they prevent that? How on earth can they do that? You can do whatever you want with your internet lmfao
35,2024-11-21 21:45:42,"Yeaah they ask for permission to send them some photos if needed but not the camera or the microphone, even when I checked in settings, there is no permission for camera.",1,"Yeaah they ask for permission to send them some photos if needed but not the camera or the microphone, even when I checked in settings, there is no permission for camera."
36,2024-11-21 19:54:51,"It do be like that. fwiw, IAM don't do any blocking or limiting.",1,"It do be like that. fwiw, IAM don't do any blocking or limiting."
37,2024-11-21 19:51:18,"I'd share interent with my laptop and it wouldn't work. Then I'd eecharge IAM sim, (have 2 sims) and get internet working. That's how I came to that conclusion. How did they do that? I don't know and I don't care.",1,"I'd share interent with my laptop and it wouldn't work. Then I'd eecharge IAM sim, (have 2 sims) and get internet working. That's how I came to that conclusion. How did they do that? I don't know and I don't care."
38,2024-11-21 20:46:14,"I had no idea, i would have just installed wifi instead ,but IAM doesnt have good offers tbh",1,"I had no idea, i would have just installed wifi instead ,but IAM doesnt have good offers tbh"
39,2024-11-21 20:05:41,"I have win sim and I share internet with my phone, pc and tv all at once and everything works smoothly… I don’t think this is a win problem.",3,"I have win sim and I share internet with my phone, pc and tv all at once and everything works smoothly… I don’t think this is a win problem."
1,2024-10-28 18:58:20,"
Welcome to r/Morocco! Please always make sure to take the time to [read the rules](https://www.reddit.com/r/morocco/wiki/rules) of this community, follow them and help us enforce them by reporting offenders. And remember that we have a zero tolerance policy for non-civil discourse and offenders risk being permanently banned.

[Don't forget to join the Discord server!](https://discord.gg/rmorocco)

**Important Notice:** Please note that the Discord channel's moderation team functions autonomously from the Reddit team. The Discord server does not extend our community guidelines and maintains a separate set of rules unrelated to those of Reddit.

Enjoy your time!


*I am a bot, and this action was performed automatically. Please [contact the moderators of this subreddit](/message/compose/?to=/r/Morocco) if you have any questions or concerns.*",1,"
Welcome to r/Morocco! Please always make sure to take the time to [read the rules]( of this community, follow them and help us enforce them by reporting offenders. And remember that we have a zero tolerance policy for non-civil discourse and offenders risk being permanently banned.

[Don't forget to join the Discord server!](

**Important Notice** Please note that the Discord channel's moderation team functions autonomously from the Reddit team. The Discord server does not extend our community guidelines and maintains a separate set of rules unrelated to those of Reddit.

Enjoy your time!


*I am a bot, and this action was performed automatically. Please [contact the moderators of this subreddit](/message/compose/?to=/r/Morocco) if you have any questions or concerns.*"
2,2024-10-28 19:25:23,"It's very common with 4G internet, it's unstable everywhere. Even with a good ping, you might notice some packet loss, and there's not much you can do about it. If you game a lot and want a more reliable connection, try getting a fiber line",2,"It's very common with 4G internet, it's unstable everywhere. Even with a good ping, you might notice some packet loss, and there's not much you can do about it. If you game a lot and want a more reliable connection, try getting a fiber line"
3,2024-10-28 19:39:08,"I do have Win by inwi, been using for months now, everything works well for me all day night, m not sure if this has to do to with your signal or you area! Any way regarding to ping it’s common with data internet it is indeed unstable, that’s why you need Fiber or at least Vdsl for gaming.",1,"I do have Win by inwi, been using for months now, everything works well for me all day night, m not sure if this has to do to with your signal or you area! Any way regarding to ping it’s common with data internet it is indeed unstable, that’s why you need Fiber or at least Vdsl for gaming."
4,2024-10-28 22:01:13,"Thats not a win by inwi issue 
Thats a 4g issue at the night kaykoun deght bzaaf thats why it becomes unstable 
You will not notice it if you're on social media or youtube but you will notice it while gaming",1,"Thats not a win by inwi issue 
Thats a 4g issue at the night kaykoun deght bzaaf thats why it becomes unstable 
You will not notice it if you're on social media or youtube but you will notice it while gaming"
5,2024-10-29 00:50:26,In the evening it’s just the corn users who usually fuck up the bandwidth due to their watching hours 😂 so you will always have a struggle 😆,1,In the evening it’s just the corn users who usually fuck up the bandwidth due to their watching hours  so you will always have a struggle 
6,2024-10-28 19:31:01,Dude I live in a university residence. That is the only option,1,Dude I live in a university residence. That is the only option
7,2024-10-28 19:56:02,"Oh, that’s unfortunate. I suggest finding a good spot with a stable network to play, and try limiting anything that might affect your ping, like Windows updates or other applications that consume internet.",1,"Oh, that’s unfortunate. I suggest finding a good spot with a stable network to play, and try limiting anything that might affect your ping, like Windows updates or other applications that consume internet."
